{
  "run_id": "20260325-164932-4760fc",
  "status": "initializing",
  "current_phase": null,
  "profile": "balanced",
  "phases_completed": [],
  "created_at": "2026-03-25T16:49:32.508Z",
  "updated_at": "2026-03-25T16:49:32.508Z",
  "token_usage": {
    "phase_tokens": 0,
    "run_tokens": 0,
    "last_threshold_triggered": null
  },
  "checkpoint_history": [],
  "active_risks": [],
  "unresolved_decisions": [],
  "rollback_metadata": null,
  "run_dir": "/home/ewonn/Documents/Personal Projects/ewonn-claude-workflow/runs/20260325-164932-4760fc"
}
